{
  "id": "science",
  "name": "Science",
  "version": "0.1.0",
  "description": "Physics, chemistry, and biology fundamentals \u2014 units and dimensional analysis, mechanics, energy, stoichiometry, cell biology, and genetics.",
  "author": "your-name",
  "license": "MIT",
  "embedding_model": "sentence-transformers/all-MiniLM-L6-v2",
  "embedding_dimension": 384,
  "routing": {
    "keywords": [
      "physics",
      "chemistry",
      "biology",
      "science",
      "force",
      "velocity",
      "acceleration",
      "momentum",
      "energy",
      "joule",
      "newton",
      "gravity",
      "thermodynamics",
      "entropy",
      "voltage",
      "current",
      "atom",
      "molecule",
      "element",
      "compound",
      "reaction",
      "mole",
      "stoichiometry",
      "molar",
      "ph",
      "acid",
      "base",
      "periodic table",
      "cell",
      "mitosis",
      "dna",
      "rna",
      "protein",
      "enzyme",
      "gene",
      "chromosome",
      "evolution",
      "photosynthesis",
      "ecosystem",
      "unit conversion",
      "significant figures",
      "grams",
      "gram",
      "solution",
      "solute",
      "solvent",
      "molarity",
      "concentration",
      "nacl",
      "dilution",
      "boiling",
      "melting",
      "oxygen",
      "hydrogen",
      "carbon",
      "salt",
      "heat",
      "wave"
    ],
    "description_for_router": "Questions about the physical and natural world: forces, motion, energy, heat, electricity, atoms, molecules, chemical reactions and balancing equations, moles and concentration, cells, DNA, evolution, ecology, unit conversion and scientific notation."
  },
  "files": {
    "prompt": "prompt.md",
    "examples": "examples.md",
    "knowledge": [
      "knowledge/percentages.md"
    ],
    "vectors": "vectors.json"
  },
  "tools": [],
  "created": "2026-07-20",
  "updated": "2026-07-20"
}